content,title
"카카오뱅크ㅡ줄여서 카뱅ㅡ사용법을 물어보시는언니야들이 계셔서~~^^이거 정말 쉽긴 한데머리 아프시면저녁에남편 님 또는 아이들에게부탁하면번.개.같.이. 빨리해줄겁니다매달 하는 적금도 있고매주 하는 적금도 있고매일 하는 적금도 있어요..게다가카뱅은집에 앉아 핸드폰으로다른 은행이로 이체할 때도수수료 0!해외송금 때도수수료 엄청 싸다네요^^저는 카뱅에서카페에서 혼자 커피 마시는 사치(?)를 끊으면서그 값으로 매일 3천원,계단오르기 하는 칭찬상금으로 매일 3천원하고 있어요~~~카카오뱅크에서카카오뱅크 가입(통장개설) & 체크카드 발급 방법
 http://naver.me/FdN5tmHS",[적금] 카카오뱅크 사용설명서
태풍이나 자연재해로 단독주택 지붕수리비 나오는 보험 있을까요?, 단독주택 지붕수리 되는 보험
아기곰님 따라하려니 처음 가입절차 복잡ㅠㅠ 해서 기업앱  사용중이라 들어가보니 놀이터 적금인가가 비슷하더라구요 소액적금~ 대신 그냥 편하게 소소하게 오늘 첨으로 12000원 입금ㅋ 매일 2000원씩 하려구요^^ 아니면 운동한날 5000원정도~~~고민중^^ 작은건데 재미나네요  한번 해보세용~~잼나네요~~^^ 전 딱 6개월만기로~~일단 이번 목표는 겨울강원도여행경비로 쓰려구요,카뱅ㅡ
,고금리 청년우대형 청약통장...
금융당국 하반기부터 달라지는 금융제도 발표했는데  올 하반기에는 소액결제업종 카드수수로가 기존 정액제에서 정률제로 변경돼 소상공인 부담이 완화될 것이라고 합니다.  또 장기소액연체자에 대한 채권매입 소각으로 경제적 자립을 돕고 부동산임대업 대출과 주택담보대출에 대한 여신심사가 강화되는 등  앞으로 대출이 많힘들어 질거 같습니다. 내집마련 더욱더 힘들어 질까요... ,하반기 달라지는 금융제도...대출이 깐깐해진다
아이 임신소식 듣고 서방이 담배끊고담배값 모아서 애기랑 여행보내준다고 모으기 시작했던 돼지를 잡았습니다ㅋ중간에 다시 피지만 않았음...유럽일주도 갔것그만ㅡㅡ오늘 잡는다고 말했더니 뜬금없이 소유권 주장하고 나옵니다ㅋㅋ확마~!주둥이 한 대 쎄리 맞고 포기하긴 했지만요ㅋ오늘은 돼지고기넣고 김치찌게 맛나게끓이줘야긋어요^^,5년된 돼지 잡은날
"매주 5천원의 투자!! 차라리란 생각들겠지만.. 전 희망을 먹고사는지라 ㅋ 그런데.. 요리조리 한줄씩 어긋나며 두개씩 참~~얄미움  ㅡㅡ;; 오늘은 돼지사진을 한참본후  잠들어야겠어요. 어디 가보자구~~~           어제 딸,아들과 송파맛집탐색!! 내입엔 별로맞지않네요 입맞에 맞으셨어요 묻는데.. 아니요할뻔 ㅋ 조금 덜 느끼해야할듯..  ",로또는 또 꽝~!!
 만원주웠어요ㅎㅎ,어제 귀가길에
전 다~갖고 싶어서 어쩌죠?..고심고심 끝에?,한가지만 골라야 한다면..과연 나는?
강동워터파크들어온다고 난리치더니.  무산ㆍ혹시 상가구하시는분  주위없을까요1년째 이자만 내고있어요. 경기가안좋은탓인지ᆢ괴롭네요    큰일입니다. ,너무괴롭네요. ᆢ이자만내고있음요.  
"제사 준비 하면서 형님이랑 얘기 하는데,아주버님 친구부부 네팀들이랑 골프 갔는데, 세팀 남편들은 마눌들 백을 차에 실어 주는데한마누라만 골프백이 남겨져 덩그라니 있어서, 형님이 뭐하시는거냐구 부인 백 좀 올려주시지!!!했더니..그 ㅅㅂㄴ이 자기 마누라 생활비 많이 주는데 자기가 이런거 까지 해줘야 돼는거냐~구 해서 울형님이 몹시 티꺼웠다구 얘기를..생활비 많이~에서 촉이 열렸는데나중에 둘이 있을 때,그와이프 천만원 받는다고..하더라구요.제가 냉큼 대답 했네요~""내가 그거 받으면 전 네~네 당신 골프백까지 제가 실어 드릴께요""전 진짜..남편 빽까지 올려주고말고요.업어줄수도 있는데~월 천만원.",생활비가 월 천만원이라면
재산세는 언제나오나요????   집장만 처음이라..납부 언제까지 해야하는지 미리 준비해야할것같아서 금액은 대충아는데 우편물이 없었거든요,올해 3월에  등기 처음했어요..
특 약갱신  이라고 2 만원이 넘게 오르네요 이거 갱신안하면 보장안되나요? 이제껏 낸거두 많은데 보험 진짜 잘 알고들어야겠어요 .,보험 
"요새 잘 지내다가 어머님이 갑자기 넘어지셔서 입원하셨네요.. 조용하게 잘 지낸다 싶었더니만 에휴.. 수술비,입원비,요양병원비,간병인비 다 하면 너무 큰 액수가 훅 나가게 되니까 생각할때마다 우울해지네요 에휴 진짜 못살겠어요!",어머님병원비로 훅 가네요..
저는 돈빌리고 주고받고하는 것을 싫어해요신혼초에 집살때도 다 은행대출받고친정이나 시댁 가족들한테도 돈빌린적업구요..친구한테도 작은돈도 빌리는성격이아니라..큰언니가 종종 돈을 몇천씩 빌려가는데..아가씨때부터.은행이자 쳐준다고 빌려달라고.근데 받을때는 이상하게 그 이자도받기 그렇고..실제 주기로한 이자보다 작게주고.또 가족끼리 그런거애기하기도..그냥 필요함 은행에서 빌리지 굳이  이자몇푼 아낄려고 그렇까싶고 그렇네요언니를 좋아하지만 성향차이인지 이런부분이 이해가안되서요.해외여행도 자주다니고 쓸데쓰는데 좀 아끼고 목돈들때는 계획을세우지 그런생각들고요.제가 맘이좁은건지..돈받을때 왠지 찜찜하고 그런게싫으네요ㅜㅜ,가족간의 돈거래.
돈 이 좀 모일만하면 나갈일이 생기네요ㅠ 세탁기랑 청소기가 쌍으로 불량이네요 10년도 안된것들이~ 쓸려고 버는 돈이지만 잠시라도 쥐고있어보고 싶은디ㅠㅠ,모였으면
아이들이 중학생인데 한4-5년 지나면 대학생.군대.직장....한집에서 같이 지낼시간이 많지않을것같아요~ 지금은 35평에 사는데 5년 후를 생각해서 20평대 아파트를 구입하는건 어떨까요? 좁을까요? ^^;;,집 평수~
